{
  "iberiaDisc": true,
  "format": 1,
  "discId": "ICD-CYBERPUNK-2077-T5N3X",
  "discType": "smart-disc",
  "game": {
    "id": "cyberpunk-2077",
    "name": "Cyberpunk 2077"
  },
  "platforms": {
    "steam": { "appIds": [1091500] },
    "gog": { "productId": "1423049311" }
  },
  "local": {
    "executables": ["Cyberpunk2077.exe"],
    "folders": ["Cyberpunk 2077"]
  },
  "artwork": {
    "cover": "cover.png"
  }
}
